{
  "schema_version": "risk_contract_validator_result.v2",
  "checked_path": "risk/contracts/v2/fixtures/valid/base_valid.json",
  "valid": true,
  "contract_identity": {
    "schema_version": "risk_contract.v2",
    "contract_version": "v2"
  },
  "validated_schema": {
    "schema_version": "risk_contract.v2",
    "contract_version": "v2",
    "path": "risk/contracts/v2/risk_contract_v2.schema.json"
  },
  "dispatch": {
    "status": "validated",
    "reason": null
  },
  "errors": []
}
